{
 "schema_version": 1,
 "namespace": "echoes.narrative",
 "content_id": "nar_campaign_canon_continuity_v1",
 "metadata": {
  "author": "Angelis Pseftis",
  "creator": "Angelis Pseftis",
  "source_locale": "en-US",
  "authority_path": "Docs/Archive/DevelopmentBible.md",
  "authority_status": "structured_projection_of_authoritative_bible",
  "content_status": "validated_authored_source",
  "runtime_consumed": false
 },
 "campaign": {
  "mission_count": 15,
  "terminal_mission_id": "TheBrokenSun",
  "mission_16_exists": false,
  "hidden_moral_score": false,
  "founding_well_doctrine_missions": [
   "WhatTheLedgerKeeps",
   "SevenAccountsOfRain",
   "ACityOnReserve",
   "TheUnburiedRoad",
   "TermsOfContinuance",
   "NamesWithoutBirths",
   "TheShapeOfSilence",
   "TheShapeBesideUs",
   "ReserveAuthority"
  ],
  "independent_lume_choice_mission": "ChoirAtLumeReach",
  "lume_protocol_receipt_missions": [
   "NoNeutralLedger",
   "TheFutureThatWon",
   "AssemblyOfTheMissing",
   "SeveralVoicesOneCommand",
   "TheBrokenSun"
  ],
  "final_resolutions": [
   "Restoration",
   "ControlledStabilization",
   "Extinguishment",
   "OpenEvolution"
  ]
 },
 "world": {
  "setting": "Soryn",
  "crownfall_rule": "Crownfall condensed unrealized causal branches into Dawnshards; consuming a shard closes the possibility it contains.",
  "future_well_rule": "A controlled Future Well offers Harvest, Preserve, or Reshape as mutually exclusive protocols with visible costs and no moral ranking.",
  "future_well_choices": [
   "Harvest",
   "Preserve",
   "Reshape"
  ],
  "factions": [
   {
    "id": "meridian_compact",
    "canon": "A culturally plural governance and logistics compact whose strength comes from reliable connected infrastructure.",
    "voice_rule": "Measured commitments, anchors, tolerances, ledgers, duty windows, and reserve margins.",
    "prohibited_reduction": "Do not treat the Compact as a single ethnicity or as the morally correct faction."
   },
   {
    "id": "kharuun_assemblies",
    "canon": "A society of layered personhood, imperfectly merged ancestral memory, mobile infrastructure, and terrain adaptation.",
    "voice_rule": "Present evidence may correct inherited certainty; dry humor comes from the mismatch.",
    "prohibited_reduction": "Do not portray the Kharuun as primitive, mystical, or governed by infallible memory."
   },
   {
    "id": "hollow_choir",
    "canon": "Coherent consciousness retained by erased branches; maintained possibilities carry public duration, cost, and counterplay.",
    "voice_rule": "Stable speech is selected from incompatible phrasing rather than delivered as a default mystical collective voice.",
    "prohibited_reduction": "Do not reveal a hidden real personality, unrestricted rewind, or cost-free complexity."
   }
  ]
 },
 "characters": [
  {
   "id": "mara_vey",
   "faction_id": "meridian_compact",
   "arc": "Disciplined preparation saves people, but her drive to make uncertainty governable can turn moral questions into control problems.",
   "mission_ids": [
    "WhatTheLedgerKeeps",
    "ACityOnReserve",
    "TermsOfContinuance",
    "ReserveAuthority",
    "ChoirAtLumeReach",
    "TheBrokenSun"
   ],
   "continuity_boundary": "Mara commands Mission 01 but is not the simulated archive-carrier entity; in Mission 10 she is an off-map liaison and in Mission 15 a protected neutral witness; in Mission 05 she is the treaty authority on the command channel while the simulated treaty and witness proxies remain unnamed."
  },
  {
   "id": "oruun_of_seven_stones",
   "faction_id": "kharuun_assemblies",
   "arc": "Oruun tests inherited memory against present evidence while confronting the accountability cost of curated communal continuity.",
   "mission_ids": [
    "WhatTheLedgerKeeps",
    "SevenAccountsOfRain",
    "TheUnburiedRoad",
    "TheShapeOfSilence",
    "ChoirAtLumeReach",
    "NoNeutralLedger",
    "TheFutureThatWon",
    "AssemblyOfTheMissing",
    "TheBrokenSun"
   ],
   "continuity_boundary": "Oruun is a Mission 01 interlocutor, becomes the Kharuun command authority in later operations, and is a protected neutral witness in Mission 15."
  },
  {
   "id": "talar_venn",
   "faction_id": "meridian_compact",
   "arc": "Talar preserves records that institutional ledgers omitted and insists that evidence remain attributable to the people who carried its cost.",
   "mission_ids": [
    "WhatTheLedgerKeeps",
    "NamesWithoutBirths",
    "TheShapeBesideUs",
    "TheBrokenSun"
   ],
   "continuity_boundary": "Talar requests the Mission 01 archive recovery, follows the census trail in Missions 06 and 08, and is a protected neutral witness in Mission 15."
  },
  {
   "id": "neme",
   "faction_id": "hollow_choir",
   "arc": "Neme negotiates among internal futures that disagree about coexistence rather than revealing one secretly dominant identity.",
   "mission_ids": [
    "TheShapeBesideUs",
    "SeveralVoicesOneCommand",
    "TheBrokenSun"
   ],
   "continuity_boundary": "Mission 08 establishes reciprocal contact, Mission 14 a bounded local Choir command contract, and Mission 15 a final local command role; none proves a unified permanent Choir identity."
  },
  {
   "id": "cael_rhyse",
   "faction_id": "meridian_compact",
   "arc": "Rhyse argues for one governable future by pointing to cities preserved under Compact policy, at an unacceptable existential cost.",
   "mission_ids": [
    "TheFutureThatWon"
   ],
   "continuity_boundary": "Mission 12 represents Rhyse only through attributable neutral public apparatus; he is not playable or commandable."
  }
 ],
 "missions": [
  {
   "sequence": 1,
   "title": "What the Ledger Keeps",
   "mission_id": "WhatTheLedgerKeeps",
   "operation_mode": "CampaignPrologue",
   "command_authority": "mara_vey",
   "command_faction": "meridian_compact",
   "named_participants": [
    "mara_vey",
    "talar_venn",
    "oruun_of_seven_stones"
   ],
   "continuity_input": [
    "No prior campaign record."
   ],
   "established_output": [
    "The archive carrier reaches Lume Reach after the archive recovery and one valid Glass Scar Well protocol.",
    "The selected Harvest, Preserve, or Reshape protocol becomes the founding Well doctrine."
   ],
   "prohibited_inferences": [
    "Mara is the simulated archive carrier.",
    "Destroying the hostile Core substitutes for evacuation.",
    "One Well protocol is the canonical moral answer."
   ],
   "mechanics_status": "bounded_operation_implemented_current_source",
   "narrative_presentation_status": "final_dialogue_cinematics_unqualified"
  },
  {
   "sequence": 2,
   "title": "Seven Accounts of Rain",
   "mission_id": "SevenAccountsOfRain",
   "operation_mode": "CampaignSevenAccounts",
   "command_authority": "oruun_of_seven_stones",
   "command_faction": "kharuun_assemblies",
   "named_participants": [
    "oruun_of_seven_stones"
   ],
   "continuity_input": [
    "Retains the Mission 01 founding Well doctrine."
   ],
   "established_output": [
    "Oruun defends a migration route while inherited accounts disagree about the terrain."
   ],
   "prohibited_inferences": [
    "Any inherited account is established as infallible.",
    "The Kharuun memory dispute is resolved."
   ],
   "mechanics_status": "bounded_operation_implemented_current_source",
   "narrative_presentation_status": "final_dialogue_cinematics_unqualified"
  },
  {
   "sequence": 3,
   "title": "A City on Reserve",
   "mission_id": "ACityOnReserve",
   "operation_mode": "CampaignCityReserve",
   "command_authority": "mara_vey",
   "command_faction": "meridian_compact",
   "named_participants": [
    "mara_vey"
   ],
   "continuity_input": [
    "Retains the Mission 01 founding Well doctrine."
   ],
   "established_output": [
    "Mara reconnects three ark-city districts in the inherited priority order."
   ],
   "prohibited_inferences": [
    "The wider city is fully recovered.",
    "All reserve consequences are resolved."
   ],
   "mechanics_status": "bounded_operation_implemented_current_source",
   "narrative_presentation_status": "final_dialogue_cinematics_unqualified"
  },
  {
   "sequence": 4,
   "title": "The Unburied Road",
   "mission_id": "TheUnburiedRoad",
   "operation_mode": "CampaignUnburiedRoad",
   "command_authority": "oruun_of_seven_stones",
   "command_faction": "kharuun_assemblies",
   "named_participants": [
    "oruun_of_seven_stones"
   ],
   "continuity_input": [
    "The Mission 01 founding Well doctrine selects the continuing route."
   ],
   "established_output": [
    "Oruun roots the Waystone, raises a Listening Spine, and recovers the missing memory shard."
   ],
   "prohibited_inferences": [
    "The recovered shard resolves the Assembly memory dispute.",
    "A complete ancestral record has been restored."
   ],
   "mechanics_status": "bounded_operation_implemented_current_source",
   "narrative_presentation_status": "final_dialogue_cinematics_unqualified"
  },
  {
   "sequence": 5,
   "title": "Terms of Continuance",
   "mission_id": "TermsOfContinuance",
   "operation_mode": "CampaignTermsOfContinuance",
   "command_authority": "mara_vey",
   "command_faction": "meridian_compact",
   "named_participants": [
    "mara_vey"
   ],
   "continuity_input": [
    "Retains the Mission 01 founding Well doctrine."
   ],
   "established_output": [
    "Meridian-authoritative treaty and witness proxies face generic Kharuun-owned Adaptive-AI pressure."
   ],
   "prohibited_inferences": [
    "Mixed-faction command is implemented.",
    "Pressure against both networks is proven.",
    "The Hollow Choir is identified."
   ],
   "mechanics_status": "bounded_operation_implemented_current_source",
   "narrative_presentation_status": "final_dialogue_cinematics_unqualified"
  },
  {
   "sequence": 6,
   "title": "Names Without Births",
   "mission_id": "NamesWithoutBirths",
   "operation_mode": "CampaignNamesWithoutBirths",
   "command_authority": "meridian_authority",
   "command_faction": "meridian_compact",